
sh mysql.sh root newpassword

create mysql.sh
#!/bin/sh

# Kill any mysql processes currently running
echo 'Shutting down any mysql processes...'
killall -vw mysqld

# Start mysql without grant tables
mysqld_safe --skip-grant-tables &

echo 'Resetting password...'

#Sleep for 5 while the new mysql process loads (if get a connection error you might need to increase this.
sleep 5

#Update user with new password
mysql mysql -e "UPDATE user SET Password=PASSWORD('$2') WHERE User='$1';FLUSH PRIVILEGES;"

echo 'Cleaning up..'

#Kill the insecure mysql process
killall -v mysqld



#Backup 
mysqldump -u USERNAME -pPASSWORD  OLD_DRUPAL_DB_NAME > new_drupal.sql

#Restore
mysql -u USERNAME -pPASSWORD  DATABASE_NAME < new_database.sql

#my.cnf
bind-address = 0.0.0.0

#create database
CREATE DATABASE tutorial_database;
mysql -u root -e "create database testdb"; 
mysql -u base_user -pbase_user_pass -e "create database new_db; GRANT ALL PRIVILEGES ON new_db.* TO new_db_user@localhost IDENTIFIED BY 'new_db_user_pass'"
mysqladmin -u$USER -p$PASSWORD create $DB_NAME

#see database
show databases;
+--------------------+
| Database           |
+--------------------+
| information_schema |
| mysql              |
| performance_schema |
+--------------------+

#choose database 
use databasename;


#see tables
show tables;        
+---------------------------+
| Tables_in_mysql           |
+---------------------------+
| columns_priv              |
| db                        |
| event                     |
| func                      |
| general_log               |
| help_category             |
| help_keyword              |
| help_relation             |
| help_topic                |
| host                      |
| ndb_binlog_index          |
| plugin                    |
| proc                      |
| procs_priv                |
| proxies_priv              |
| servers                   |
| slow_log                  |
| tables_priv               |
| time_zone                 |
| time_zone_leap_second     |
| time_zone_name            |
| time_zone_transition      |
| time_zone_transition_type |
| user                      |
+---------------------------+

#delete database
DROP DATABASE database name;

#Let’s create a new MySQL table
CREATE TABLE potluck (id INT NOT NULL PRIMARY KEY AUTO_INCREMENT, 
name VARCHAR(20),
food VARCHAR(30),
confirmed CHAR(1), 
signup_date DATE);

#see table 
DESCRIBE potluck;
+-------------+-------------+------+-----+---------+----------------+
| Field       | Type        | Null | Key | Default | Extra          |
+-------------+-------------+------+-----+---------+----------------+
| id          | int(11)     | NO   | PRI | NULL    | auto_increment |
| name        | varchar(20) | YES  |     | NULL    |                |
| food        | varchar(30) | YES  |     | NULL    |                |
| confirmed   | char(1)     | YES  |     | NULL    |                |
| signup_date | date        | YES  |     | NULL    |                |
+-------------+-------------+------+-----+---------+----------------+
5 rows in set (0.01 sec)

#How to Add Information to a MySQL Table
INSERT INTO `potluck` (`id`,`name`,`food`,`confirmed`,`signup_date`) VALUES (NULL, "John", "Casserole","Y", '2012-04-11');
INSERT INTO `potluck` (`id`,`name`,`food`,`confirmed`,`signup_date`) VALUES (NULL, "Sandy", "Key Lime Tarts","N", '2012-04-14');
INSERT INTO `potluck` (`id`,`name`,`food`,`confirmed`,`signup_date`) VALUES (NULL, "Tom", "BBQ","Y", '2012-04-18');
INSERT INTO `potluck` (`id`,`name`,`food`,`confirmed`,`signup_date`) VALUES (NULL, "Tina", "Salad","Y", '2012-04-10'); 

#We can take a look at our table
mysql> SELECT * FROM potluck;
+----+-------+----------------+-----------+-------------+
| id | name  | food           | confirmed | signup_date |
+----+-------+----------------+-----------+-------------+
|  1 | John  | Casserole      | Y         | 2012-04-11  |
|  2 | Sandy | Key Lime Tarts | N         | 2012-04-14  |
|  3 | Tom   | BBQ            | Y         | 2012-04-18  |
|  4 | Tina  | Salad          | Y         | 2012-04-10  |
+----+-------+----------------+-----------+-------------+
4 rows in set (0.00 sec)

#How to Update Information in the Table
UPDATE `potluck` 
SET 
`confirmed` = 'Y' 
WHERE `potluck`.`name` ='Sandy';

#How to Add and Delete a Column
ALTER TABLE potluck ADD email VARCHAR(40);
ALTER TABLE potluck ADD email VARCHAR(40) AFTER name; 

#How to Delete a Row
DELETE from [table name] where [column name]=[field text];
mysql> DELETE from potluck  where name='Sandy';
Query OK, 1 row affected (0.00 sec)
mysql> SELECT * FROM potluck;
+----+------+-----------+-----------+-------------+
| id | name | food      | confirmed | signup_date |
+----+------+-----------+-----------+-------------+
|  1 | John | Casserole | Y         | 2012-04-11  |
|  3 | Tom  | BBQ       | Y         | 2012-04-18  |
|  4 | Tina | Salad     | Y         | 2012-04-10  |
+----+------+-----------+-----------+-------------+
3 rows in set (0.00 sec)







ALTER TABLE moneytabletest MODIFY moneyfield fixed(10,2);

If your table has these characteristics

table is called moneytable
field you wish to convert is called moneyfield
primary key is called moneyid
Then run these commands:

DROP TABLE IF EXISTS moneytabletest;
CREATE TABLE moneytabletest LIKE moneytable;
ALTER TABLE moneytabletest MODIFY moneyfield fixed(10,2);
INSERT INTO moneytabletest SELECT * FROM moneytable;
SELECT A.moneyid,A.moneyfield olddata,B.moneyfield newdata
FROM moneytable A LEFT JOIN moneytabletest B USING (moneyid)
WHERE A.moneyfield <> B.moneyfield;

# change the type for the column 
# How do I change the data type for a column in MySQL?
#http://dev.mysql.com/doc/refman/5.1/en/alter-table.html

ALTER TABLE tablename MODIFY columnname INTEGER;

#How to convert a column of type TEXT to VARCHAR?

ALTER TABLE table_name MODIFY column_name VARCHAR(X)


mysql> SHOW CREATE DATABASE test\G

mysql> SHOW CREATE SCHEMA test\G

#Select all rows that have column value larger than some value

Yes it is possible.

SELECT * FROM MyTable 
WHERE rank > (SELECT Rank FROM MyTable WHERE username = 'e')
or you can also use self-join for the same

SELECT t1.* FROM MyTable t1
  JOIN MyTable t2
    ON t1.Rank > t2.Rank
   AND t2.username = 'e';

If you wanted to convert all the values in the name column to lower case or upper case permanantly, you could do this:

UPDATE mytable SET name = LOWER(name);
UPDATE mytable SET name = UPPER(name);

The error 2 is because you should use this path: 'C:/Stuff/dumpfile.sql' instead of 'C:\Stuff\dumpfile.sql'

You could also try 'C:\\Stuff\\dumpfile.sql', but the unix like path it's the way to go.

But the easiest way is this:

















